PILPROJ;Deb;PILPROJ_DEB_FR_1;Conversations;Quelle icône permet d'ajouter des participants à une conversation de groupe? ;Which icon can add participants to a group conversation? (To add a participant to a group conversation, which icon should I use?);Icône Activer la vidéo//Icône Ajouter des participants//Icône Détacher la fenêtre;Activate video icon//Add participants icon//Pop out chat icon;"Si je dois ajouter des nouvelles personnes à une conversation de groupe, j'utilise la fonctionnalité ""Ajouter des participants"" au lieu de créer une nouvelle conversation. ";"When I have to add new people to a group conversation, I use the ""Add Participants"" feature instead of creating a new conversation.";B;QCMUniqueImage
PILPROJ;Deb;PILPROJ_DEB_FR_2;Conversations;Que fait Megan dans la vidéo?;What is Megan doing in the video?;Elle ajoute des nouvelles personnes dans la conversation.//Elle partage tout l'historique de conversation.//Elle ajoute des nouvelles personnes dans la conversation et elle partage l'historique de la conversation datant de 2 jours.;She is adding new people to the conversation.//She shares all the conversation history.//She is adding new people to the conversation and is sharing 2 days of the conversation history.;Quand j'ajoute une nouvelle personne à une conversation de groupe, je lui partage l'historique de conversation pour qu'elle dispose de toutes les informations sur le projet. ;When I add a new person to a group conversation, I share the conversation history so they have all the information about the project.;C;QCMUniqueVideo
PILPROJ;Deb;PILPROJ_DEB_FR_3;Fichiers;Est-ce que je peux travailler simultanément avec mes collègues sur un même fichier Powerpoint? ;Can I work simultaneously with my colleagues on the same PowerPoint file?;Ce n'est pas possible aujourd'hui dans Teams.//Si un.e collègue travaille déjà sur le fichier, je ne serai qu'en lecture seule.//Bien sûr, la co-édition est possible dans Teams, sur Excel, Word, PowerPoint ou OneNote!;This is not possible today in Teams.//If a colleague is already working on the file, it will be read-only.//Of course, co-editing is possible in Teams, Excel, Word, PowerPoint or OneNote!;Je partage mes fichiers dans mes équipes Teams. Ainsi, mes collègues et moi-même pouvons travailler sur une même version d'un document, plutôt que d'envoyer des versions successives par email.;I share my files in my Teams channels, so my colleagues and I can work on the same version of a document, rather than sending successive versions by email.;C;QCMUnique
PILPROJ;Deb;PILPROJ_DEB_FR_4;Fichiers;Je travaille avec mon équipe sur un fichier Excel partagé dans Teams. Quelle est la bonne pratique pour informer Alex qu'il y a une erreur sur une de ses formules?;I work with my team on an Excel file shared in Teams. What is the best way to inform Alex that there is an error on one of his formulas?;Je lui envoie un email avec une capture d'écran de la formule.//J'ajoute un commentaire en le @mentionnant sur la cellule concernée et je lui envoie un message sur Teams.;I send him an email with a screenshot of the formula.//I add a comment @mentionning him on the cell concerned and I send him a message on Teams.;"Si j'ai des questions sur une zone spécifique d'un fichier Word, Powerpoint ou Excel, je vais dans l'onglet ""Révision"" du document et j'insère des ""Commentaires"" et j'utilise le @mention. Cela permettra à la personne concernée d'apporter rapidement la réponse à ma question. ";"If I have questions about a specific area of a Word, Powerpoint or Excel file, I go to the ""Review"" tab of the document and insert ""Comments"" and use the @mention. This will allow the person concerned to quickly respond to my question.";B;QCMUnique
PILPROJ;Deb;PILPROJ_DEB_FR_5;Applications;Je souhaite suivre l'avancement d'un projet en attribuant des tâches aux membres de l'équipe. On m'a conseillé d'utiliser Planificateur. Quelle icône correspond à Planificateur? ;"I want to follow the progress of a project by assigning tasks to team members. I was advised to use Planner. Which icon belongs to Planner? (I was advised to use an App called ""Planner"") - lets not assume that they know Planner right away.";Icône OneNote//Icône Excel//Icône Planificateur//Icône Forms ;OneNote Icon//Excel Icon//Planner Icon//Forms Icon;Pour suivre l'avancement d'un projet, j'utilise l'application Planificateur que je peux épingler à mon canal. Je peux affecter des tâches à des personnes spécifiques et ajouter des dates limites d'exécution. Cela me permet de suivre l'avancement du projet en un seul endroit !;To track the progress of a project, I use the Planner app that I can add to a channel or pin to my navigation bar. I can assign tasks to specific people and add execution deadlines. This allows me to follow the progress of the project in one place!;C;QCMUniqueImage
PILPROJ;Deb;PILPROJ_DEB_FR_6;Applications;Sur Teams, je peux épingler une application dans une équipe. Dans quel onglet puis-je retrouver le catalogue d'applications disponibles? ;In Microsoft Teams, I can add an app to a team. In which tab can I find the catalog of available apps? ;Onglet Activité//Onglet … //Onglet Applications;Activity tab//Tab ...//Applications tab;Quand je travaille sur une application tierce avec mon équipe, je vérifie qu'elle est disponible dans le catalogue d'applications de Teams et je l'épingle dans un des canaux. ;If we use a third-party application with my team, I can check whether it's available in the Teams app catalog and pin it to one of the channels.;C;QCMUniqueImage
PILPROJ;Deb;PILPROJ_DEB_FR_8;Statut/Raccourcis;Dans mon flux d'activités (notifications), je retrouve: ;In my activity feed (notifications), I can find:;Les réactions à mes publications dans les canaux.//Mes appels manqués.//Les publications où je suis mentionné.e.//Les trois réponses ci-dessus.;Reactions to my posts in the channels.//My missed calls.//The publications where I am mentioned.//All of the above.;"Je consulte mes notifications depuis l'onglet ""Activités"" et j'utilise les filtres pour retrouver facilement une publication où on me mentionne.";"I check my notifications from the ""Activity"" tab and I can use the filters to easily find a post where I'm mentioned.";D;QCMUnique
PILPROJ;Deb;PILPROJ_DEB_FR_9;Appels;Que fait Alex dans la vidéo? ;What is Alex doing in the video?;Il crée une réunion.//Il crée une conversation de groupe.//Il crée un groupe de contacts d'appels.;He creates a meeting.//He creates a group conversation.//He creates a group of call contacts.;"Si je dois joindre régulièrement des personnes spéficiques à une équipe, je crée un groupe de contacts pour les retrouver facilement dans l'onglet ""Appels"". Cela m'évite de parcourir tout mon historique d'appels. ";"If I have to regularly add specific people to a team, I create a group of contacts to easily find them in the ""Calls"" tab. This saves me from going through my entire call history.";C;QCMUniqueVideo
PILPROJ;Deb;PILPROJ_DEB_FR_10;Appels;J'ai besoin d'une information urgente de la part de Julie. Mais elle est absente et son message d'absence indique d'appeler son responsable Martin L. Comment trouver le numéro de ce dernier? ;I need urgent information from Julie. But she is away and her out of office message recommends calling her manager Martin L. How do do I find his telephone number? ;"Je demande à mon responsable s'il connaît le numéro de Martin L. .//Je peux retrouver les informations de Martin L. en cliquant sur l'onglet ""Organisation"" dans ma conversation avec Julie.//J'attends le retour de Julie. ";"I ask my manager if he knows Martin L.'s number//I can find Martin L.'s contact details by clicking on the ""Organization"" tab in my conversation with Julie.//I'll wait for Julie's return.";"Quand une nouvelle personne de mon organisation me contacte et que je souhaite savoir à quelle équipe cette personne est rattachée, j'utilise l'onglet ""Organisation"" situé dans notre conversation. ";"When a new person in my organization contacts me and I want to know which team that person is part of, I can use the ""Organization"" tab in our conversation.";B;QCMUnique
PILPROJ;Deb;PILPROJ_DEB_FR_11;Calendrier;"Vrai ou faux? Toute personne qui utilise la fonctionnalité ""Assistant de planification"", aura accès aux détails de mon calendrier. ";"True or false? Everyone who uses the ""Scheduling Assistant"", will have access to the details of my calendar.";Vrai//Faux;"True//False
";"J'utilise la fonctionnalité ""Assistant de planification"" pour voir les créneaux disponibles de mes interlocuteurs. S'ils ne m'ont pas partagé leurs calendriers sur Outlook, je n'aurai pas accès aux détails de leurs calendriers. Si une case est vide, cela signifie qu'ils sont disponibles, si elle est pleine, ils sont occupés, si elle est composée de rayures, ils sont occupés provisoirement et si elle est rouge, ils sont absents. ";"I can use the ""Scheduling Assistant"" feature to check the availability of my participants. If they have not shared their Outlook calendar, I will not see the details of their schedules. If a box is empty, it means they are available, if the box is filled with a colour, they are busy, if it is filled with stripes, they are tentative and if the box is red, they are away.";B;QCMUnique
PILPROJ;Deb;PILPROJ_DEB_FR_12;Calendrier;Pour avoir une vue sur mes réunions de la semaine, je peux filtrer la vue de mon calendrier par: ;If I want to have a view of all my upcomign meetings, I have options in my calendar to filter the view by : ;Jour//Semaine//Semaine de travail//Mois;Day//Week//Work Week//Month;En début de semaine, je prends connaissance des réunions programmées de la semaine. Je me bloque du temps dans mon agenda pour pouvoir avancer sur mes dossiers de fond. ;At the beginning of the week, I can check my agenda to see my meetings of the week. I can also block some time in my agenda to work on my projects.;B//C;QCMMultipleVideo
PILPROJ;Deb;PILPROJ_DEB_FR_13;Équipe/Discussions;Que fait Alex dans la vidéo? ;What is Alex doing in the video?;Il crée une conversation de groupe.//Il crée une équipe.//Il ajoute plusieurs canaux dans son équipe.//Il crée une réunion. ;He creates a group conversation.//He creates a team.//He adds more channels to a team.//He creates a meeting.;Dans mes équipes, je crée différents canaux  pour organiser les conversations par sujets, projets et disciplines spécifiques. Par analogie, l'équipe correspond à une maison et les canaux correspondent à plusieurs pièces de la maison. ;In my teams, I create different channels to organize conversations by specific topics, projects and disciplines. By analogy, if the team is a house the channels are the rooms in the house. ;B//C;QCMMultipleVideo
PILPROJ;Deb;PILPROJ_DEB_FR_14;Équipe/Discussions;Je souhaite modifier les membres de mon équipe projet. Comment faire? ;How can I change the memebers in my team project?;"Ce n'est pas possible.//Je clique sur les trois points ""…"" à côté du nom de l'équipe et je vais dans ""Gérer l'équipe"".//Je supprime l'équipe et je recommence à zéro. ";"This is not possible.//I click on the three dots ""..."" next to the team name and I go to ""Manage team"".//I delete the team and start from scratch.";En tant que propriétaire d'une équipe, je peux ajouter à tout moment des nouveaux membres ou en supprimer.;As a team owner, I can add or delete new members at any time.;B;QCMUnique
PILPROJ;Inter;PILPROJ_INT_FR_1;Conversations;Pourquoi il est conseillé de renommer une conversation de groupe? ;Why it is advisable to rename a group conversation?;Pour la retrouver facilement à partir de la barre de recherche.//Pour identifier rapidement le thème abordé.//Pour structurer mes conversations de groupe.;To find it easily from the search bar.//To quickly identify the topic addressed.//To structure my group conversations.;Je peux retrouver des interlocuteurs similaires dans mes conversations de groupe. Je nomme toujours mes nouvelles conversations de groupe pour identifier le sujet abordé et le retrouver facilement à partir d'un mot clé. ;I always name my new group conversations to identify the topic addressed and find it easily from a keyword.;A//B//C;QCMMultiple
PILPROJ;Inter;PILPROJ_INT_FR_2;Conversations;Comment m'assurer que les membres de ma conversation de groupe ont bien vu mon message? ;How do I make sure the members of my group conversation have seen my post?;"Je les appelle pour leur demander. //Je leur renvoie le même message.//Je clique sur Autres options ""…"" pour accéder à la liste des vues par membre.";"I call them to ask.//I send the same message to them individually.//I click on ""More Options ""..."" to access the list of views per member.";"Dans une conversation de groupe, je structure mes messages pour ne pas noyer mes interlocuteurs de messages. Je clique sur ""Autres options"" pour savoir qui a vu mon message. ";"In a group conversation, I structure my posts so I don't spam my teammates with several messages. I click on ""More options"" to see who has seen my message.";C;QCMUnique
PILPROJ;Inter;PILPROJ_INT_FR_3;Fichiers;Mon équipe et moi tenons à jour un fichier Excel de suivi de données. Existe-t-il un moyen d'y avoir facilement accès ?;My team and I are keeping an up-to-date data tracking file in Excel. Is there an easy way to access it?;"Il ne peut pas y avoir de tri ou de sélection, tous les fichiers sont dans l'onglet ""Fichiers ""du canal ou de la conversation.//Oui, je peux épingler un fichier dans la barre d'onglet d'une conversation ou d'un canal. ";"All files are in the ""Files"" tab in the channel or in the conversation.//Yes, I can pin a file as a tab in the conversation or channel.";Pour permettre à mon équipe d'accéder rapidement à un document clé, je l'épingle dans le canal adéquat. ;To allow my team to quickly access a key document, I pin it in the appropriate channel.;B;QCMUnique
PILPROJ;Inter;PILPROJ_INT_FR_4;Fichiers;Je souhaite retrouver l'ancienne version d'un document partagé dans Teams, quel est le bon parcours? ;I want to get the old version of a shared document in Teams, what is the right path?;"Une fois le document ouvert, je clique sur le nom du document en haut de l'interface.//Je clique sur ""Historique des versions"". //Pour commencer, je vais dans l'onglet ""Fichiers"" et j'ouvre le document dans l'application.//Enfin, je sélectionne la version que je souhaite récupérer dans la fenêtre de droite. ";"After opening the document, I click on the document's name at the top of the interface.//I click ""Version History"".//To start, I click on the ""Files"" tab and I open the document into the application.//Then, I select the version I want to restore in the right window.";En partageant un document dans une équipe, je suis sûr.e qu'il n'y a plus qu'une seule version de document. Je suis sûr.e de travailler sur la dernière version à jour et si besoin je peux télécharger une ancienne version à une date précise, en utilisant l'historique des versions. ;By sharing a document in a team I am making sure there is only one version of this document and I'm sure i'm working on the latest and most updated version. If necessary I can download an older version from a specific date, using the version history.;C//A//B//D;BonParcours
PILPROJ;Inter;PILPROJ_INT_FR_5;Applications;De nouveaux membres vont rejoindre mon équipe projet. Comment faire en sorte que la navigation de l'équipe sur Teams soit intuitive ?;New members are joining my team project. How can I make using the team intuitive for them?;J'ajoute un onglet OneNote qui recense tout ce qu'il faut savoir sur l'équipe.//J'ajoute un onglet Excel qui recense tout ce qu'il faut savoir sur l'équipe.//J'ajoute un onglet avec un fichier PDF qui recense tout ce qu'il savoir sur l'équipe.;I add a OneNote tab which lists everything you need to know about the team.//I add an Excel tab which lists everything you need to know about the team.//I add a tab with a PDF file which lists everything you need to know about the team.;Lorsqu'il s'agit d'accueillir un nouveau membre dans mon équipe projet, pour faciliter son intégration, je peux mettre en place une FAQ, une liste de tâches du nouvel arrivant, une liste de procédures et de liens utiles, etc…et tout ça dans un onglet OneNote. ;When it comes to welcome a new member into my project team I can set up an FAQ, a list of tasks for the new member, a set of links, etc ... and all of it embedded in a OneNote tab.;A;QCMUnique
PILPROJ;Inter;PILPROJ_INT_FR_6;Applications;J'aimerais avoir une vue sur l'avancement des tâches de mon équipe projet. Quel outil dois-je privilégier dans Teams ?;I wish I had a view of the task progress of my project team. What tool should I use in Teams?;Planificateur, qui est un outil Microsoft entièrement intégré à Teams et synchronisé avec Outlook.//Un outil de gestion de projet déjà mis en place dans mon entreprise et qui s'intègre à Teams (Trello, Jira, Asana, …).//Excel;Planner, which is a Microsoft tool, fully integrated and synchronized with Outlook.//A project management tool which is already set up in my company and which fully integrates with Teams (Trello, Jira, Asana, ...).//Excel;Utiliser des applications spécifiques à la gestion des tâches et de projets permet à mon équipe d'être plus efficace et de réduire l'envoi de messages ou d'emails sur la progression des tâches.;Using specific applications for managing tasks and projects allows my team to be more efficient and decrease the volume of messages or emails related to the completion of these tasks;A//B;QCMMultiple
PILPROJ;Inter;PILPROJ_INT_FR_7;Statut/Raccourcis;Je travaille sur des sujets importants et je souhaite être informé.e par email des activités manquées sur Teams. Comment faire? ;I work on important topics and I would like to remain informed by email about missed activity on Teams. How can I do that?;"Je vais dans ""Paramètres"".//Je commence par cliquer sur mon profil.//Je vais dans ""Notifications"".//Enfin, je définis la fréquence des ""Courriers concernant les activités manquées"". ";"I go to ""Settings"".//I first click on my profile.//I go to ""Notifications"".//I define the frequency of ""Emails about missed activities.""";Pour ne rien rater des notifications importantes sur mes projets, je paramètre mes notifications et je suis informé.e de tout même en consultant mes emails!;In order not to miss important updates about my projects, I set up my notifications and then remain informed of everything while I am looking at my emails.;B//A//C//D;BonParcours
PILPROJ;Inter;PILPROJ_INT_FR_8;Statut/Raccourcis;"Dans une équipe, on peut avoir un statut de ""Propriétaire"" ou de ""Membre"". Pourquoi est-il conseillé de nommer plusieurs propriétaires dans une équipe? ";"In a team, you can either have a status of ""Owner"" or ""Member"". Why is it recommended to appoint several owners in a team?";"Ce n'est pas conseillé, il faut un seul propriétaire par équipe. //Définir plusieurs propriétaires permet aux autres propriétaires de continuer à gérer les paramètres et les droits de l'équipe, même en cas d'absence. //Il est conseillé plutôt de nommer tous les membres comme ""Propriétaire"". ";"It is not recommended. You should have only one owner per team.//By setting several owners, you allow other owners to continue managing settings and rights of the team when the first owner is out of office//It is instead recommended to appoint all members as ""Owner"".";Quand je crée une équipe, je nomme directement 2 ou 3 propriétaires qui pourront gérer l'équipe au cas où je m'absente ou je quitte la société. ;When I create a team, I choose 2 or 3 owners who will manage the team if I'm away or in case I leave the company.;B;QCMUnique
PILPROJ;Inter;PILPROJ_INT_FR_9;Appels;Julie est en déplacement professionnel, et elle souhaite joindre la réunion hebdomadaire par téléphone. Où peut-elle trouver le numéro de téléphone associé? ;Julie is on a business trip,  she wants to join the weekly meeting through her phone. Where can she find the meeting phone number?;"En cliquant sur la réunion depuis son calendrier Outlook.//En cliquant sur la réunion depuis son calendrier Teams.//En allant dans l'onglet ""Appels"".";"By clicking on the meeting from her Outlook calendar//By clicking on the meeting from Teams//In her calendar in the ""Calls"" tab.";Quand je crée une réunion Teams depuis Outlook, je vérifie toujours que les éléments de connexion à la réunion sont ajoutés automatiquement en bas de l'invitation. Ces informations de connexion sont disponibles aussi bien sur Teams que sur Outlook ! ;When I create a Teams meeting from Outlook, I always check that the different elements of the meeting are automatically added to the bottom of the invitation. These credentials are available in both Teams on Outlook!;A//B;QCMMultiple
PILPROJ;Inter;PILPROJ_INT_FR_10;Appels;Comment suis-je informé.e qu'une réunion est lancée dans un canal? ;How am I informed when a meeting is launched in a channel?;Je reçois une notification Teams m'informant que quelqu'un a démarré la réunion.//Une icône Caméra s'affiche à côté du nom du canal.//Réponse C. ; I get a Teams notification informing me that someone started the meeting.//A camera icon appears right next to the name of channel.//Answer C.;"Je peux rejoindre une réunion de canal en me rendant dans le canal et en cliquant sur ""Rejoindre"". ";"I can join a channel meeting by going  into the channel and clicking ""Join"".";A//B;QCMMultiple
PILPROJ;Inter;PILPROJ_INT_FR_11;Calendrier;Vrai ou Faux? Je peux inviter des externes à une réunion Teams avec mon équipe projet.;True or false? I can invite external guests to a Teams meeting with my project team.;"Vrai//Faux
";"True//False
";Je peux inviter des externes à une réunion Teams en ajoutant leurs adresses email dans l'invitation. Même si les personnes externes ne sont pas familières avec Teams, elles peuvent rejoindre et participer  à la réunion Teams grâce aux éléments de connexion inclus dans l'invitation. ;I can invite external guests to a Teams meeting by adding their email addresses in the invitation. Even if the guests are not familiar with Teams, they can join and participate to the Teams meeting thanks to the links and elements included in the invitation.;A;QCMUnique
PILPROJ;Inter;PILPROJ_INT_FR_12;Calendrier;Quelle est la durée de réunion conseillée pour un point de synchronisation hebdomadaire? ;What is the recommended duration of a weekly synchronization meeting?;2 heures//45 min//1 heure;2 hours//45 minutes//1 hour;Pour les réunions hebdomadaires avec mon équipe, je détermine un agenda en avance et je privilégie les réunions de 45 minutes pour laisser à tout le monde 15 minutes de battement avant la prochaine réunion. ;For weekly meetings with my team, I set up an agenda beforehands and I pefer 45 minutes to let everyone a 15 minutes break before the next meeting.;B;QCMUnique
PILPROJ;Inter;PILPROJ_INT_FR_13;Équipe/Discussions;J'ai besoin de co-créer ou de partager des informations confidentielles avec certains membres de mon équipe, comment faire? ;I need to co-create or share confidential information with some members of my team, how can I do that ?;Je leur envoie un email.//Je crée une nouvelle équipe pour traiter les sujets confidentiels.//Je crée un canal privé au sein de mon équipe. ;I send them a email.//I create a new team to handle confidential matters.//I create a private channel in my team.;"Il est plus intéressant de créer un canal privé dans une équipe qu'une conversation de groupe ou un email, car de cette manière toute l'information portant sur un même projet est conservée au même endroit et non pas dispersée entre une équipe, des conversations, des emails... Pour cela, je clique sur ""Plus d'options …"", puis sur ""Ajouter un canal"". Un canal privé n'est seulement visible et accessible que par les membres sélectionnés.";"It is better to create a private channel in a team rather than a group conversation or an email. This way all of the information related to a project is stored in the same place and won't get lost among team conversations and emails. To do this, I click ""More options ..."" and then ""Add channel"". A private channel can only be seen and accessed by selected members.";C;QCMUnique
PILPROJ;Inter;PILPROJ_INT_FR_14;Équipe/Discussions;Dans une équipe, pour attirer l'attention sur ma publication je peux :  ;In a team, to draw attention to my publication I can:;"Mettre en forme mon message en cliquant sur l'icône ""Format"" en forme de A.//Utiliser le mode ""Annonce"".//Mentionner des personnes spécifiques.//Utiliser les trois techniques évoquées ci-dessus. ";" Format my message by clicking on the format icon shaped ""A"".//Use the ""Announcement"" mode.//Mention specific people.//Use the three techniques mentioned above.";"Par défaut, les notifications des canaux sont désactivées. Il est donc important que je mentionne les membres de mon équipe mais également que je rende ma publication attrayante pour attirer l'œil de mon audience. Pour mettre en forme une publication, je clique sur l'icône ""Format"" en forme de A pour accéder à toutes les options. ";"By default, channel notifications are disabled. It is important to @mention the members of my team but I also need to make my publication appealing to attract the eye of my colleagues. To format a publication, I click on the format icon (""A"") to access all the options.";D;QCMMultiple
