REU;Deb;REU_DEB_FR_9;Appels;Quelles icônes permettent de transformer une conversation de groupe en une réunion adhoc? ;Which icons can transform a group conversation in an adhoc meeting?;Icône Vidéo//Icône Audio//Icône Participant;Icon Video//Icon Audio//Icon Participant;;#VALUE!;A//B;QCMMultipleImage
REU;Deb;REU_DEB_FR_10;Appels;Je suis en réunion, j'interviens mais personne ne réagit à ma proposition…. Que se passe-t-il? ;I'm in a meeting. I am talking but nobody responds to my proposal .... What's going on?;"Mon micro est coupé.//Mon micro est coupé mais Teams a détecté que je parlais, le message ""Votre microphone est coupé"" s'affiche donc.//Mes collègues sont partis prendre un café.";"My microphone is muted.//My microphone is muted but as Teams has detected that I am speaking, the message ""Your microphone is muted"" pops up.//My colleagues have left the meeting to grab a coffee.";Teams détecte et conseille proactivement les participants lorsque de petites erreurs communes impactent le bon déroulé d'une réunion. ;Teams detects and proactively advises participants when small common mistakes impact the efficiency of a meeting.;B;QCMUnique
REU;Deb;REU_DEB_FR_11;Calendrier;Quel est le bon parcours pour créer une réunion Teams à partir d'Outlook ? ;What are the right steps to create a Teams meeting from Outlook?;"Enfin, je clique sur le bouton ""Réunion Teams"".// Je crée une ""Nouvelle réunion"".//Je vais dans l'onglet ""Calendrier"".//Je commence par ouvrir Outlook.";"Finally, I click on the ""Teams Meeting"" button.//I create a ""New Meeting"".//I click on ""Calendar"".//I first open Outlook.";Les fonctionnalités habituellement disponibles dans Outlook sont présentes : rendre cette réunion périodique, utiliser l'assistant de planification pour identifier le meilleur créeau horaire pour tous les participants.;The features usually available in Outlook are available: make the meeting recurrent, use the Scheduling assistant to identify the best time slot for all participants.;D//C//B//A;BonParcours
REU;Deb;REU_DEB_FR_12;Calendrier;Vrai ou faux? Dans Teams, lorsque je crée une réunion, je peux accéder à l'Assistant planification.;True or false? In Teams, when I create a meeting, I can access the Scheduling Assistant;Vrai//Faux;Right//Wrong;"Lorsque je crée une réunion dans Teams, une fois que j'ai indiqué les participants, je peux cliquer sur l'onglet ""Assistant de planification"" pour vérifier leurs disponibilités.";When I create a meeting in Teams, once I have typed participants names, I can click on the Scheduling assistant tab to check their availability.;A;QCMUnique
REU;Deb;REU_DEB_FR_13;Équipe/Discussions;Nous allons avoir notre réunion de service dans 2 heures, et 4 de mes collègues sont malades, donc absents….Comment faire pour qu'ils accèdent aux contenus de la réunion? ;We will have our staff meeting in 2 hours and 4 of my colleagues are sick, so out office.  How do I make sure that they will easily get access to the content of the meeting?;"Si la fonctionnalité est disponible dans mon entreprise, je peux enregistrer la réunion pour les absents.//Depuis l'onglet ""Conversations"", ils auront également accès aux fichiers et liens partagés pendant la réunion.//Ils auront accès au compte-rendu de la réunion car on utilise toujours les ""Notes partagées"".//J'appelerai un à un les absents pour leur résumer le contenu de la réunion. ";"If the feature is available in my prganisation, I can record the meeting for absents.//From the ""Conversations"" tab, they will also have access to files and links shared during the meeting.//They will have access to the minutes of the meeting because we always use the ""shared Notes"".//I'll call the absents one by one to summarize the content of the meeting.";L'enregistrement des réunions, s'il est autorisé par l'entreprise, permet aux absents de prendre connaissance de la réunion, ou de revisionner individuellement des moments de cette réunion.;The meeting recording, if authorized by the organisation, allows absents to access the content of the meeting, or individually replay moments of the meeting.;A//B//C;QCMMultiple
REU;Deb;REU_DEB_FR_14;Équipe/Discussions;Une nouvelle personne vient d'intégrer mon équipe. Pour être rapidement opérationnelle, elle souhaite savoir où elle peut accéder aux notes de la réunion hebdomadaire de l'équipe. Elle peut les retrouver dans l'onglet…;A new person has joined my team. To be onboarded quickly, she wants to know where she can find the notes of the weekly team meeting. She can find them in the tab ...;"Dans l'onglet ""Conversation""//Dans l'onglet ""Fichiers de la réunion""//Dans l'onglet ""Notes de la réunion""";"In the ""Conversation"" tab//In the ""Meeting Files"" tab//In the ""Meeting Notes"" tab";Pour les réunions périodiques, j'encourage mes collègues à utiliser les notes partagées pour avoir une synthèse des points abordés par date. ;For recurring meetings, I encourage my colleagues to use shared notes for a summary of the points raised by date.;C;QCMUniqueImage
REU;Inter;REU_INT_FR_1;Conversations;"Je lis le message que Paul m'a envoyé mais je n'ai pas le temps d'y répondre de suite; je souhaite le mettre en évidence pour y répondre plus tard. Comment faire? ";I read a message that Paul just sent to me but I don't have time to answer now. I would like to highlight it to respond later. How can I do that?;Je m'envoie un email de rappel. //Dans les conversations Teams, je marque la conversation comme non lue.//J'appelle Paul.;I send an email reminder.//In Teams' conversations, I mark the conversation as unread.//I call Paul;Lorsqu'une conversation est marquée comme non lue, une notification reste affichée dans la colonne de gauche de Teams.;When a conversation is marked as unread, a notification is displayed in the left rail of Teams.;B;QCMUnique
REU;Inter;REU_INT_FR_2;Conversations;Quels types de conversations puis-je épingler en haut de ma liste de conversations?;Which chats can I pin to the top of my chat list?;Les conversations privées.//Les conversations de groupe.//Les conversations de réunion.//Les conversations masquées. ;Private chats.//Group chats.//Meeting chats.//Hidden chats.;"Pour bien organiser mon onglet ""Conversation"", j'épingle mes conversations favorites en haut de mon interface. Je peux épingler: les conversations de réunions, les conversations de groupe et les conversations privées (1:1). ";"To organize my ""chat"" tab, I pin my favorite chats at the top of my left rail. I can pin: meeting chats , group chats and private chats (1: 1).";A//B//C;QCMMultiple
REU;Inter;REU_INT_FR_3;Fichiers;Comment faire au mieux pour partager un document avant ma réunion? ;What is the best way for me to share a document before a meeting?;Je l'envoie par email aux participants de la réunion.//Je le partage depuis mon OneDrive dans la conversation de la réunion.//Je l'envoie par voyageur intergalactique !  ;I can send an email to the meeting participants.//I can share it via OneDrive in the meeting conversation.//I can send it by intergalactic traveler!;"Le mieux est de partager le support depuis mon OneDrive dans la conversation de la réunion: ainsi, tous les échanges ayant trait à cette réunion sont centralisés.
De plus, grâce à la synchronisation de OneDrive et Teams, même mes toutes dernières modifications apportées au document seront visibles des participants. ";"The best way is to share the media via OneDrive in the meeting conversation: all discussions related to this meeting are then centralized.
Moreover, thanks to the OneDrive and Teams synchronization, my very latest document updates will be visible to the participants.";B;QCMUnique
REU;Inter;REU_INT_FR_4;Fichiers;Qui peut télécharger la liste des participants à une réunion? ;Who can download the list of participants for a meeting?;Tous les participants.//Seuls les membres de mon organisation.//Seul l'organisateur.rice de la réunion.;All participants.//Only members of my organization.//Only the meeting organizer.;;#VALUE!;C;QCMUnique
REU;Inter;REU_INT_FR_5;Applications;J'ai organisé une réunion Teams pour former mes collègues sur l'utilisation d'une nouvelle application métier. Dans le bac de partage de la réunion, je sélectionne: ;I organized a Teams meeting to train my colleagues on on how to use a new app. In the sharing tray, I select: ;"Partager un fichier ""PowerPoint""//Partager mon ""Bureau""//Partager une ""Fenêtre""";"Share a ""PowerPoint"" file//Share my desktop//Share a ""Window""";Je partage une seule fenêtre quand j'ai besoin de n'afficher qu’une seule chose et que je veux masquer le reste de l’écran. Quand je navigue sur mon bureau, les participants ne voient que la fenêtre que j'ai partagée. ;I share a window when I only need to show one thing and want to keep the rest hidden. When I navigate on my dekstop, participants only see the window that I shared.;C;QCMUnique
REU;Inter;REU_INT_FR_6;Applications;"Pendant une réunion, si on me demande de partager une présentation Powerpoint, il est conseillé de sélectionner ""Partager un Fichier PowerPoint"" plutôt que ""Partager une fenêtre"" car: ";"During a meeting, if I am asked to share a PowerPoint presentation, it is preferable to select ""Share a PowerPoint file"" rather than ""Share a window"" because:";Les participants bénéficieront de fonctionnalités spéciales.//Les participants pourront se déplacer dans différentes diapositives sans interrompre la présentation principale.//Les participants peuvent synchroniser leur affichage avec l’affichage du présentateur d’un simple clic.//Les trois réponses ci-dessus.;Participants will benefit from special features.//Participants will be able to view the various slides without interrupting the current presentation.//Participants can synchronize their display with the display of the presenter with a simple click.//All of the  above.;"Pendant une réunion, si nous devons présenter à plusieurs une présentation, je sélectionne ""Partager un Fichier Powerpoint"" dans le bac de partage. Ainsi, les autres participants pourront la parcourir à leur propre rythme sans interrompre la présentation principale. Plus besoin de dire ""Reviens sur la slide 2""! Je peux également donner la main aux autres présentateurs sans arrêter le partage et reprendre le contrôle à tout moment. ";"During a meeting, if presenting with others using the same presentation, I select ""Share a PowerPoint file"" from the sharing tray. The other participants can see the slides at their own pace without interrupting the main presentation. No need to say ""can you please go back to slide 2?""! I can also let the other presenter switch slides without having to stop sharing and regain control at any time.";D;QCMUnique
REU;Inter;REU_INT_FR_7;Statut/Raccourcis;Vrai ou faux? Lorsque je crée une réunion sur Teams, je peux définir un statut des participants à la réunion : Obligatoire/Facultatif.;True or false? When I create a Teams meeting, I can set a status of participants in the meeting: Mandatory / Optional.;Vrai, je peux le définir de la même façon que dans Outlook.//Faux;True, I can set it in the same way as in Outlook.//False;Je n'hésite pas à définir certains invités à ma réunion comme Facultatifs, s'ils ne sont pas indispensables à cette réunion.;I have the option to set some guests as optional,  if they are not required to have this meeting.;A;QCMUnique
REU;Inter;REU_INT_FR_8;Statut/Raccourcis;Quelle action me permet de mettre fin à la réunion pour tous les participants? ;Which action allows me to end the meeting for all participants?;"Image ""Activer la caméra""//Image ""Quitter""//Image ""Mettre fin à la réunion""";"""Turn on camera"" image//""Exit"" image//""End the Meeting"" image ";"En tant qu'organisateur.rice de réunion, je peux choisir de ""Quitter"" la réunion mais celle-ci continuera pour les autres participants, ou bien je peux ""Mettre fin à la réunion"" pour tous les participants.  ";"As meeting organizer, I can chose to ""leave"" the meeting, but the meeting will continue for other participants; or I can ""end"" the meeting for all participants. ";C;QCMUniqueImage
REU;Inter;REU_INT_FR_9;Appels;Je suis en télétravail et je m'apprête à suivre une réunion, mais mon environnement est mal rangé….Comment masquer cette réalité à mes interlocuteurs? ;I am working from home and I am about to join a meeting, but my environment is messy ... .How can I hide this from other meeting participants?;Je n'active pas ma caméra.//Je peux appliquer des effets d'arrière-plan.//Je peux flouter mon arrière-plan.;I do not turn on my camera.//I can apply background effects.//I can blur my background.;J'active au maximum ma caméra pendant les réunions, afin de conserver l'attention de tous.;Whenever possible, I prioritize turning on my camera during meetings to keep everyone's attention.;B//C;QCMMultiple
REU;Inter;REU_INT_FR_10;Appels;Je suis en réunion avec mon équipe de commerciaux, et nous avons besoin d'interroger l'expert en droit commercial de notre entreprise. Quel est le bon parcours pour l'ajouter à la volée à notre réunion?  ;I am in a meeting with my sales team, and we need to as the commercial law expert of our company a question. What is the right path to add him on the fly to our meeting?;"Je clique sur ""Afficher les participants"".//La réunion est en cours.//Je tape ensuite le nom de l'expert en droit commercial dans la zone de saisie.//Enfin, la réunion appelle automatiquement le participant.";"I click ""View Participants"".//The meeting is ongoing.//I then type the name of the expert in the open tab.//The meeting the automatically calls the participant.";;#VALUE!;B//A//C//D;BonParcours
REU;Inter;REU_INT_FR_11;Calendrier;Puis-je créer une réunion Teams périodique? ;Can I create a recurring Teams meeting?;Oui depuis Outlook, je peux créer une nouvelle réunion Teams avec une périodicité //Oui depuis Teams, je peux créer une nouvelle réunion avec une périodicité //Oui depuis Planificateur;Yes, I can create a new Teams meeting with recurring parameters in Outlook.//Yes, I can create a new Teams meeting with recurring parameters in Teams directly.//Yes, via Planner.;;#VALUE!;A//B;QCMMultiple
REU;Inter;REU_INT_FR_12;Calendrier;Je suis en train de créer une réunion Teams et je souhaite paramétrer ses options, comment faire? ;When I am creating a Teams meeting how can I change the Mtg Options?;Dans l'invitation Outlook de la réunion, je peux accéder aux options//Dans l'invitation Teams de la réunion, je peux accéder aux options//Je ne peux pas paramétrer les options de la réunion;In the meeting Outlook invitation, I can access options//In the meeting Teams invitation, I can access options//I cannot set the meeting options.;Dans les options, je pourrai paramétrer des élements tels que la salle d'attente ou le rôle de présentateur. ;In the options, I can set elements such as the waiting room or the presenter role.;A//B;QCMMultiple
REU;Inter;REU_INT_FR_13;Équipe/Discussions;Je souhaite modifier une publication que j'ai écrite car j'ai indiqué un taux de renouvellement de 70% alors qu'il est en ce moment de 80 % : comment faire? ;I want to modify a post I wrote because I have indicated a 70% renewal rate when it is currently 80%: how do I do this? ;"Je vais sur ma publication et je clique sur l'emoji ""Fâché"".//Je vais sur ma publication et je clique sur ""Répondre"".//Je vais sur ma publication et je clique sur ""…"" (Plus d'options) et ""Modifier"".";"I go to my post and click on the ""Angry"" emoji.//I go to my post and click on ""Reply"".//I go to my post and click ""..."" (More options) and ""Modify.""";Je peux modifier facilement une petite erreur dans une publication. ;I can easily modify a small error in a post.;C;QCMUnique
REU;Inter;REU_INT_FR_14;Équipe/Discussions;Je souhaite organiser une réunion de division avec les équipes régionales et on compte 50 personnes à inviter. Est-ce que je peux inviter tout le monde dans une réunion Teams? ;I want to organize a division meeting with the regional teams and there are 50 people to invite. Can I invite everyone to a Teams meeting?;Oui car je peux inviter jusqu'à 300 personnes dans une réunion Teams. //Oui car je peux inviter jusqu'à 50 personnes dans une réunion Teams. //Non je ne peux pas inviter autant de personnes à une réunion Teams. ;Yes I can invite up to 300 people to a Teams meeting.//Yes I can invite up to 50 people to a Teams meeting.//No, I can't invite this many people to a Teams meeting.;Sur Teams, je peux organiser des réunions jusqu'à 300 personnes. Pratique pour les réunions générales trimestrielles, les appels régionaux et en plus, tout le monde peut joindre la réunion de n'importe où !;On Teams, I can organize meetings for up to 300 people. Convenient for quarterly general meetings, regional calls and, anyone can join the meeting from anywhere!;A;QCMUnique
REU;Avance;REU_AVA_FR_1;Conversations;Que puis-je partager dans la conversation d'une réunion? ;What can I share in a meeting conversation?;Un fichier Excel, Word, Powerpoint, PDF...//Une image//Un GIF//Un lien de site internet;An Excel, Word, Powerpoint, PDF file...//An image//A GIF//A website link;Je peux partager énormément d'informations ou de fichiers dans une conversation de réunion. ;I can share a lot of information or files in a meeting conversation.;A//B//C//D;QCMMultiple
REU;Avance;REU_AVA_FR_2;Conversations;Je transforme une conversation en une réunion ad hoc quand: ;I can turn a conversation into an ad hoc meeting when:;Je veux apporter des commentaires rapides.//Je veux aider quelqu'un en temps réel.//Quand je veux enregistrer notre réunion.;I want to provide quick feedback.//I want to help someone in real time.//When I want to record our meeting.;"Lorsque je crée une réunion rapide depuis une conversation de groupe, je n'ai pas accès aux fonctionnalités avancées des réunions. Si je souhaite ""Enregistrer la réunion"", utiliser la fonction""Lever la main"", avoir des ""Notes partagées""… je dois créer la réunion depuis mon ""Calendrier"" Teams. ";"When I create a quick meeting from a group conversation, I don't have access to the advanced features of meetings. If I want to ""Save the meeting,"" use the ""Raise your hand"" feature, have ""Shared Notes"" ... I have to create the meeting from my ""Calendar"" Teams.";A//B;QCMMultiple
REU;Avance;REU_AVA_FR_3;Fichiers;J'ai organisé une formation via Teams avec l'équipe commerciale. Je vais démarrer la formation et je souhaite accéder à la liste des personnes présentes. Quel est le bon parcours pour y accéder? ;I have organized a training through Teams with the sales team. I will start the training and I need to get access to the list of attendees. What is the right path to get there?;"Je clique sur ""Afficher les participants"". //D'abord, je démarre la réunion depuis mon calendrier Teams.//Enfin, je clique sur ""Télécharger la liste d'assiduité"".//Je peux consulter le rapport au format .CSV .";"I click ""Show participants.""//First, I start the meeting from my Teams calendar.//Finally, I click ""Download the attendance list"".//I can view the report in format .csv.";Je peux organiser une formation via une réunion Teams et télécharger la liste des participants. Cela me permet d'assurer un suivi et de relancer ceux qui n'ont pas pu y assister. ;I can organize a training through a Teams meeting and download the list of attendees. This allows me to follow up and reach back to those who have not been able to attend.;B//A//D//C;BonParcours
REU;Avance;REU_AVA_FR_4;Fichiers;Vrai ou faux? Le rapport d'assiduité des participants à une réunion contient le nom, l'action (a rejoint), la date et l'heure de l'action pour chacun des participants. ;True or false? The attendance report of a meeting contains the name, the action (joined), the date and time of the action for each of the attendees.;Vrai//Faux;True//False ;En tant qu'organisateur de la réunion, je peux ainsi savoir à quelle heure les différents participants sont arrivés.;As the organizer of the meeting, I can find out what time the different participants joined.;A;QCMUnique
REU;Avance;REU_AVA_FR_5;Applications;"Vrai ou faux? Utiliser l'outil ""Planificateur"" pour faire du suivi d'actions d'une réunion à l'autre est pertinent. ";"True or false? Using the ""Planner"" tool to track actions from one meeting to the next is relevant.";Vrai//Faux;True//False ;"L'application ""Planificateur"" peut être épinglée à un canal et ainsi permettre un suivi dynamique des actions des équipes. ";"The ""Planner"" application can be pinned to a channel and thus allow dynamic monitoring of team actions.";A;QCMUnique
REU;Avance;REU_AVA_FR_6;Applications;J'ai enregistré une réunion Teams avec des clients. Mon client me dit qu'il n'arrive pas à lire l'enregistrement de la réunion. Comment faire? ;I recorded a Teams meeting with customers. My client tells me that he cannot read the recording of the meeting. How can I do?;Il ne fait pas partie de mon organisation, il n'a pas accès à l'enregistrement.//Je télécharge la vidéo sur mon PC et je lui envoie en pièce jointe d'un email.//J'ouvre l'enregistrement sur Microsoft Stream et je modifie les autorisations de la vidéo. ;He is not part of my organization, he does not have access to the recording.//I download the video to my PC and I send it as an attachment of an email.//I open the recording on Microsoft Stream and I edit the permissions of the video.;"J'accède facilement à Microsoft Stream par le portail ""Office.com.""";"I easily access Microsoft Stream through the ""Office.com"" portal.";C;QCMUnique
REU;Avance;REU_AVA_FR_7;Statut/Raccourcis;Je viens de brancher mon casque pour participer à une réunion. Mais le son sort de mon PC. Quel est le bon parcours pour régler ce problème? ;I just plugged my headset to attend a meeting.  But the sound comes out of my PC. What is the right path to solve this problem?;"Enfin, je sélectionne ""Afficher les paramètres de périphérique"".//Pour commencer, je sélectionne mon casque dans les ""Périphériques Audio"".//Je clique ensuite sur les trois points ""…"" dans la barre de contrôle.";"Finally, I select ""Show device settings"".//To begin with, I select my headset in the ""Audio Devices"".//I then click on the three dots ""..."" in the control bar.";;;B//C//A;BonParcours
REU;Avance;REU_AVA_FR_8;Statut/Raccourcis;La semaine prochaine, je pars en congés. Mes collègues sauront que je ne pourrai pas assister aux réunions car: ;I'm going on vacation next week. My colleagues will know that I will not be able to attend the meetings because:;"J'ai paramétré mon message d'absence sur Outlook.//Mon statut Teams sera sur ""Absent(e) du bureau"".//J'ai prévenu tout le monde par email que j'ai pris ma semaine. ";"I set my leave message on Outlook status.//My Teams status will be on ""out of office"".//I warned everyone by email I am off this week.";"Quand je pars en congés, j'informe par chat les personnes avec qui je travaille en permanence. Je modifie mon message de statut et je réponds en sélectionnant ""Refuser"" aux organisateurs de réunions programmées sur ma période de congés. ";"When I go on leave, I inform by chat the people I work with often. I change my status message and respond by selecting ""Decline"" to the organizers of meetings scheduled during my holidays.";A//B;QCMMultiple
REU;Avance;REU_AVA_FR_9;Appels;Lors d'une présentation, je dois lancer une vidéo. Quel est le bon parcours pour que les participants entendent le son de ma vidéo à travers le partage d'écran ?;During a presentation, I have to launch a video. What is the right path for participants to hear the sound of my video through screen sharing?;"Ensuite je coche ""Inclure le système audio"" en haut à gauche de la fenêtre.//Enfin je partage la fenêtre contenant la vidéo.//Je sélectionne l'icône ""Partager du contenu"".//Tout d'abord Je démarre la réunion.";" I check ""Include audio system"" at the top left of the window.//I share the window containing the video.//I select the ""Share content"" icon.//I start meeting first.";Je peux également coller le lien de la vidéo dans le chat de la réunion, pour consultation ultérieure par les participants.;I can also paste the video link in the chat of the meeting, for further consultation by the attendees.;D//C//A//B;BonParcours
REU;Avance;REU_AVA_FR_10;Appels;Quelle icône permet de désactiver tous les micros des participants rejoignant une réunion? ;Which icon can disable all the microphones of attendees joining a meeting?;"Icône"" Désactiver mon micro""//Icône ""Inviter quelqu'un""//Icône ""Désactiver tous les micros""";" ""Turn off my microphone"" Icon//""Add someone"" Icon//Icon ""Deactivate all microphones""";Si nécessaire, je peux désactiver le micro des participants qui rejoignent ma réunion. ;If necessary, I can turn off the microphone of the attendees who join my meeting.;C;QCMUniqueImage
